Paper Title,Abstract
A Natural Human-Robot Interaction System for Teleoperation Based on Noncontact Haptic Feedback,"In order to provide natural and immersive interactive experience for teleoperation in the context of human-robot collaboration and interaction, this work introduces a natural human-robot interaction system for teleoperation based on ultrasonic haptic feedback. Specifically, our system can accurately capture an operator's hand movements and replicate these actions on the remote robot with low latency and high fidelity. It utilizes an ultrasonic phased array to achieve non-contact haptic feedback. We propose a dynamic ultrasonic array acoustic field customization method based on interactive feature information image. This method can dynamically adjust the acoustic field according to the operator's hand characteristics, focus on multiple target points in real time, and project them onto an operator's fingertips, thereby providing force-controllable non-contact haptic feedback to the operator. The operator is integrated into the feedback loop of our system, controlling the system through multimodal feedback to form a high-quality human-in-the-loop closed control system. The system's performance is validated in two classic robotic tasks: block pick-and-place and nut-tightening. The experimental results show that the system exhibits excellent accuracy and dexterity, and can efficiently complete tasks with high accuracy while providing great interactive experience for operators."
SuperMag: Vision-Based Tactile Data Guided High-Resolution Tactile Shape Reconstruction for Magnetic Tactile Sensors,"Magnetic-based tactile sensors (MBTS) combine the advantages of compact design and high-frequency operation but suffer from limited spatial resolution due to their sparse taxel arrays. This paper proposes SuperMag, a tactile shape reconstruction method that addresses this limitation by leveraging high-resolution vision-based tactile sensor (VBTS) data to supervise MBTS super-resolution. Co-designed, open-source VBTS and MBTS with identical contact modules enable synchronized data collection of high-resolution shapes and magnetic signals via a symmetric calibration setup. We frame tactile shape reconstruction as a conditional generative problem, employing a conditional variational auto-encoder to infer high-resolution shapes from low-resolution MBTS inputs. The MBTS achieves a sampling frequency of 125 Hz, whereas the shape reconstruction sustains an inference time within 2.5 ms. This cross-modality synergy advances tactile perception of the MBTS, potentially unlocking its new capabilities in high-precision robotic tasks."
A Neuromorphic Tactile System for Reliable Braille Reading in Noisy Environments,"Neuromorphic sensors are a promising technology in artificial touch due to their low latency and low computational and power requirements, particularly when paired with spiking neural networks (SNNs). Here, we explore the ability of these systems to adapt to and generalize across varying sources of uncertainty in tactile tasks. We choose Braille reading as an application task and collect event-based data for 27 braille characters with a neuromorphic tactile sensor (NeuroTac) under varying conditions of tapping speed, center position and indentation depth using a 6-DOF robot arm. We initially analyze the effect of spatial location and speed on classification performance with spiking convolutional neural networks (SCNNs). We then show that SCNNs are able to generalize across each dimension. The final general SCNN model reaches 95.33% accuracy with uncertainty in all 4 dimensions. This research demonstrates the noise degradation performance of SCNNs in a tactile task, and outlines the potential of a single SCNN to generalize across several dimensions of uncertainty."
Self-Sensing Liquid Crystal Elastomer Actuator with Magnetic-Thermal Synergy,"Fueled by the rapid evolution of robotics, the demand for intelligent and lightweight robotic systems continues to grow across industries. However, conventional designs often separate sensing and actuation, resulting in structural complexity and diminished reliability. While integrated sensor-actuator systems offer a promising solution, they face significant challenges in manufacturing and scalability. Liquid crystal elastomer (LCE) are widely utilized in actuators for their thermally responsive deformation and programmability, while Neodymi-um-Iron-Boron (NdFeB) nanoparticles provide exceptional magnetic properties for sensing. This paper introduces a novel Self-Sensing LCE (SS-LCE) actuator, seamlessly combining LCE and NdFeB to enable simultaneous actuation and self-sensing capabilities. Under thermal stimulation, the actua-tor executes complex motions while delivering real-time feed-back through magnetic field variations. Its programmability and adaptable fabrication process support diverse motion modes, unlocking broad application potential. By enhancing integration, reliability, and flexibility, this self-sensing actuator represents a pivotal advancement in the development of light-weight, intelligent robotic systems with significant research and industrial implications."
Vision-Based Tactile Sensor Using Light-Conductive Plate for Enhanced Force Sensing Capability,"In recent years, tactile sensors have become essential for robotic systems, particularly in tasks requiring high-precision interaction and manipulation. The Vision-Based Tactile Sensor (VBTS) represents a significant advancement in tactile sensing, utilizing cameras to monitor the deformation of soft materials at the sensor tip. Pressure applied to the sensor alters the light propagation path, thereby changing the image captured by the camera. By combining image processing and deep learning, VBTS provides highly accurate estimates of contact position and force, achieving micrometer-level resolution. This paper presents a novel VBTS design that leverages a light-conductive plate and a silicone membrane to enhance the sensor's sensitivity to force perception. The soft, thin nature of the silicone membrane allows for precise detection of minimal forces, making it suitable for tasks involving highly deformable objects. Experimental results demonstrate the sensor's capability in detecting contact areas and force distributions, which can be applied in diverse domains such as soft object assembly, medical assistance, and food processing. Moreover, the proposed VBTS outperforms traditional sensors by utilizing computationally efficient algorithms that maintain real-time performance without compromising resolution."
Soft Tactile Sensors for Robot Grippers Using Acoustic Sensing,"We present a low-cost, soft tactile sensor using common, easily sourced materials that can be integrated with existing robotic gripper systems without requiring complex fabrication techniques or expensive components. Our approach includes two designs: a flexible linear sensor constructed from a rubber tube and a planar sensor made with a rubber membrane stretched over an enclosure. Both sensors contain an embedded speaker and microphones that leverage active acoustic sensing to map the unique acoustic resonant response of the cavity's structure to deformations that occur when the robotic gripper is grasping an object. Experimental results demonstrate that, using a support vector machine, the linear sensor achieves contact point estimation with an RMSE of 6mm, while the planar sensor achieves an RMSE of 0.57-0.62mm. Additionally, the planar sensor classifies six objects with an accuracy of 97.7%. These results demonstrate the potential for active acoustics to be an accessible method for enabling tactile sensing capabilities for robotic systems."
Electrical Impedance Tomography Based Finger-Shaped Soft Artificial Skin,"Obtaining dense contact information for feedback control is vital for robotic manipulation. However, existing tactile sensing technologies have a large footprint, making seamless integration with current robotic devices difficult. This paper presents a novel multi-layer Electrical Impedance Tomography (EIT) sensor architecture designed to provide distributed, high-density tactile sensing with a small form factor. Using our multilayer structure, we address a common issue in other EIT-based tactile skins that prevents electrodes from being placed distally from the sensing surface. Our innovative multi-layer design enables the development of complex-shaped soft sensing skins without any electronic components on the sensing surface, achieving very high accuracy. To demonstrate practical applications, we fabricated a finger-shaped three-dimensional (3D) skin and conducted experiments to collect real-world data. We developed a perception model for the tactile sensor by employing data-driven machine learning methods to predict press localization and force with high accuracy based on EIT signals. Our work presents a significant step towards developing whole body full soft tactile sensors with a small form factor."
M3D-Skin: Multi-Material 3D-Printed Tactile Sensor with Hierarchical Infill Structures for Pressure Sensing,"Tactile sensors have a wide range of applications, from utilization in robotic grippers to human motion measurement. If tactile sensors could be fabricated and integrated more easily, their applicability would further expand. In this study, we propose a tactile sensorâ€”M3D-skinâ€”that can be easily fabricated with high versatility by leveraging the infill patterns of a multi-material fused deposition modeling (FDM) 3D printer as the sensing principle. This method employs conductive and non-conductive flexible filaments to create a hierarchical structure with a specific infill pattern. The flexible hierarchical structure deforms under pressure, leading to a change in electrical resistance, enabling the acquisition of tactile information. We measure the changes in characteristics of the proposed tactile sensor caused by modifications to the hierarchical structure. Additionally, we demonstrate the fabrication and use of a multi-tile sensor. Furthermore, as applications, we implement motion pattern measurement on the sole of a foot, integration with a robotic hand, and tactile-based robotic operations. Through these experiments, we validate the effectiveness of the proposed tactile sensor."
A Multimodal Robust Recognition Method for Grasping Objects with Robot Flexible Grippers (I),"In light of the critical importance of achieving robust object recognition from multimodal data in robotic operations, this article proposes a precise identification method tailored for the grasping of objects using a multi-flexible gripper in scenarios characterized by multimodality, limited samples, and complex environments. Terming the BOSS-MI-ELM algorithm, this approach innovatively extracts [bag-of-SFA-symbols (BOSS)], fusion [association-based fusion (AF)], and classifies [incremental extreme learning machine (I-ELM)] features from multimodal data, facilitating an efficient recognition process. The study employs fiber Bragg grating (FBG) and inertial measurement unit (IMU) as information acquisition components, constructing a multimodal perception system and establishing a corresponding grasping dataset. Through training and testing on this dataset, empirical evidence demonstrates that even with the utilization of only 20% of the dataset, the BOSS-MI-ELM algorithm maintains a classification accuracy of 95.54%. In the presence of Gaussian noise with a mean of 0 and varying standard deviations, as well as different degrees of partial data loss, the proposed method still maintains robust recognition performance. In addition, we have validated the effectiveness of this method in identifying objects grasped at different speeds. Furthermore, comparative experiments were conducted on two publicly available multimodal tactile datasets. The results indicate that the BOSS-MI-ELM algorithm outperforms various baseline models. The extensive experiments collectively demonstrate that this system provides a viable solution for robot object recognition under multimodal tactile perception."
A Deep Reinforcement Learning Based End-To-End Control Framework for Lower Limb Exoskeletons with Smooth Movement Transitions,"This paper presents an active control strategy for lower limb exoskeletons by proposing an end-to-end framework employing deep reinforcement learning (DRL) to enable smooth transitions between different movement patterns. The majority of existing methods in exoskeleton literature employ finite state machines (FSM) that have proven successful in predicting the control strategy for the next state on the basis of sensor data such as IMU data, force, etc. However, one drawback of FSM occurs due to their inflexibility regarding sudden changes. Specifically, FSM is based on clear state transitions, which makes it hard to manage smooth continuous movements and increases the chance of sudden changes in control during transitions. These, in turn, raise safety concerns for the user. While learning-based control approaches have been suggested in recent years, the validation was performed in simulation environments. Therefore, the real-world applicability remains an open research question to date. To address this issue, we provide the first contribution in this field that proposes an end-to-end learning framework with a Deep Deterministic Policy Gradient (DDPG) module to enable smooth transitions between movement patterns under real-world conditions. By introducing several evaluation metrics, we demonstrate that our framework outperforms existing methods in terms of the adaptability and smoothness in movement transitions."
VibeCheck: Using Active Acoustic Tactile Sensing for Contact-Rich Manipulation,"The acoustic response of an object can reveal a lot about its global state, for example its material properties or the extrinsic contacts it is making with the world. In this work, we build an active acoustic sensing gripper equipped with two piezoelectric fingers: one for generating signals, the other for receiving them. By sending an acoustic vibration from one finger to the other through an object, we gain insight into an object's acoustic properties and contact state. We use this system to classify objects, estimate grasping position, estimate poses of internal structures, and classify the types of extrinsic contacts an object is making with the environment. Using our contact type classification model, we tackle a standard long-horizon manipulation problem: peg insertion. We use a simple simulated transition model based on the performance of our sensor to train an imitation learning policy that is robust to imperfect predictions from the classifier. We finally demonstrate the policy on a UR5 robot with active acoustic sensing as the only feedback. Videos can be found at https://roamlab.github.io/vibecheck."
"TwinTac: A Wide-Range, Highly Sensitive Tactile Sensor with Real-To-Sim Digital Twin Sensor Model","Robot skill acquisition processes driven by reinforcement learning often rely on simulations to efficiently generate large-scale interaction data. However, the absence of simulation models for tactile sensors has hindered the use of tactile sensing in such skill learning processes, limiting the development of effective policies driven by tactile perception. To bridge this gap, we present TwinTac, a system that combines the design of a physical tactile sensor with its digital twin model. Our hardware sensor is designed for high sensitivity and a wide measurement range, enabling high quality sensing data essential for object interaction tasks. Building upon the hardware sensor, we develop the digital twin model using a real-to-sim approach. This involves collecting synchronized cross-domain data, including finite element method results and the physical sensor's outputs, and then training neural networks to map simulated data to real sensor responses. Through experimental evaluation, we characterized the sensitivity of the physical sensor and demonstrated the consistency of the digital twin in replicating the physical sensorâ€™s output. Furthermore, by conducting an object classification task, we showed that simulation data generated by our digital twin sensor can effectively augment real-world data, leading to improved accuracy. These results highlight TwinTac's potential to bridge the gap in cross-domain learning tasks."
A Compliant Tube for Series Elastic Actuators to Generate High Output Torque,"Series elastic actuators (SEAs) achieve output torque and stiffness control by managing the deformation of a spring arranged between the motor and the output. SEAs are ideal for tasks involving human-robot interaction and unstructured environments. The stiffness, size, and torque capacity of the spring are crucial for the performance of an SEA. To increase the torque capacity of an SEA while maintaining a compact size, this paper proposes a novel helical flexure as the spring in an SEA. The helical flexure is formed on the thin wall of a tube to generate high torque output with minimal reaction forces and moments. The resulting compliant tube can be combined with other transmission components to reduce the number of components and allow the inner passage of cables and shafts. Simulation comparisons and experimental testing verify the merits of the proposed helical flexure. An SEA prototype is fabricated to demonstrate the performance of the new helical flexure during zero-torque and high-torque motion."
A Compact Robotic Wrist with Embedded Torque Sensing for Peg-In-Hole Tasks,"This paper presents the design and experimental validation of a torque-controlled robotic wrist for peg-in-hole tasks. The proposed wrist features a serial pitch-yaw joint configuration that enhances dexterity while maintaining compactness. The design integrates stepper motors, harmonic geartrains, and compliant mechanisms to optimize torque output and control accuracy. A compliant pulley and a compliant cap are introduced, enabling embedded torque sensing without the need for external sensors, thereby reducing system complexity and improving response time. Experimental results demonstrate the effectiveness of the wrist in torque accuracy and misalignment correction during peg-in-hole assembly, highlighting the benefits of the compliant-driven torque sensing approach. Compared to existing robotic wrists, the proposed design achieves a higher torque density. The findings contribute to advancing robotic wrist technology, particularly in applications requiring precise force modulation, high dexterity, and adaptable compliance."
A Lightweight 3-Axis Permanent Magnetic Sponge-Based Self-Adapting Tactile Sensor,"Tactile sensors are indispensable in robotic systems because they deliver vital contact information during environmental interactions. In our work, we leverage the variable compliance of a porous materialâ€”where different interaction forces induce varying degrees of complianceâ€”to achieve self-adapting tactile sensing. This distinctive non-linear characteristic allows its sensitivity to be tuned over a range from 0.008 mT/N to 0.045 mT/N. After coating with a magnetic polymer, the porous material functions as a 3-axis magnetic sensing medium. Its length and width are set at 30 mm and 35 mm respectively to accommodate the printed circuit board. To preserve the overall measuring range, it is designed with a thickness of 15 mm. This thickness enables monitoring of the volumetric changes due to the enhanced compliance, which is suitable for three-dimensional shape recognition. In this work, we present the design, fabrication, experimental characterization, and applications of an lightweight 3-axis magnetic sponge sensor with overall dimensions of 30 mm (width) Ã— 35 mm (length) Ã— 17 mm (height) and a detection range of 60 N. Notably, the sensing material weighs only 2 g, thanks to its porous structure."
Muscle-On-A-Chip: A Self-Healing Actuator Platform in Robotic Systems,"The regulation of muscle function is very important for tissue engineering and sports science. This paper presents a simple microfluidic chip platform and its control method to investigate the regulation of muscle function. By employing C2C12 cells as the model system for skeletal muscle research, these cells were inoculated onto the microfluidic chips and induced to differentiate into fully functional muscle tubes. Programmable actuation control enables localized strain gradients within the microfluidic platform, achieving differential mechanical regimes for functional modulation of integrated muscle constructs. The system implements mechanical conditioning to recapitulate exercise-induced myocyte damage and subsequent regenerative processes through controlled deformation protocols. Our radial-strain actuators generate 19.4% maximum principal strain, while axial-strain configurations achieve 8.3% baseline deformation. Dynamic input modulation enables precise strain reduction to 7.4% and 2.2%, respectively establishing differential mechanical regimes for simulating exercise-associated functional impairment (high-strain phase) and recovery processes (low-strain phase). This strain-programmable platform establishes a robust framework for investigating mechanobiological thresholds in functional muscle regeneration."
Touch-Linked Sleeve: A Haptic Interface for Augmented Tactile Perception in Robotic Teleoperation,"Tactile perception is crucial for robots to interact effectively with their environments, particularly in cluttered settings or when visual sensing is unavailable. However, a major limitation is the insufficient coverage of tactile sensors on current robots, which makes navigating cluttered spaces challenging due to the lack of capability to detect collisions. This limitation also hinders the use of teleoperation systems in such spaces by reducing the human operatorâ€™s situational awareness. To address this issue, this paper proposes the Touch-Linked Sleeve (TLS), a haptic mapping system that redirects contact on robot arms to human skin. The system consists of a tactile skin for contact detection and a haptic sleeve that enables human operators to experience telepresented contact. By establishing a transparent mapping between the robot's tactile skin and the user's haptic sleeve, operators can intuitively sense contacts from the robotâ€™s perspective. To evaluate the systemâ€™s effectiveness, we conducted experiments demonstrating the functionality of both the tactile skin and the haptic sleeve. Moreover, we performed human studies using a virtual reality robot teleoperation interface to simulate navigation and manipulation in a cluttered scenario. The results indicate that the proposed system enhances perceptual transparency during object grasping tasks, leading to improved task completion times, fewer collisions, and improved overall usability."
Wearing a Robotic Hand to Feel 3D Force Feedback: Analysis and Virtual Reality Application of the Hand-In-Hand System,"Virtual Reality (VR) robot embodiment is a popular method for teleoperation and generating data to train AI control systems. A potential flaw with this approach is an incongruence in human-robot haptics. Without tactile feedback, teleoperators depend on visual cues, leading to suboptimal performance (slow movement, faulty grasps, excessive contact force). This problem is exacerbated during robot hand teleoperation. Worse, many haptic hand wearables are cable-driven and only produce unidirectional resistive force, thus failing to cover the gamut of 3D finger interactions. In this paper, a critical gap in teleoperated human-robot hand haptics is addressed by transforming an inexpensive (~500 USD) 3D-printed robotic hand into a wearable exoskeletonâ€”the ""Hand-in-Hand"" (HiH) systemâ€”which provides fingertip 3D force feedback. Methods for force control, null-space optimization, and human finger pose estimation are presented and experimentally validated. Each finger of the device can produce a maximum of 1 N of force feedback in any 3D direction. HiH finger tracking is compared to an industry-grade device (MANUS Metagloves, 5000 USD) and realizes an average inferred joint position Normalized Root Mean Square Error of 33.46%. Lastly, the HiH is demonstrated within a VR robot embodiment experiment with force feedback. Operator hand-manipulation performance improved when using force feedback, emphasizing the HiH's potential for teleoperated robot control and data collection."
