Paper Title,Abstract
Learning Dexterous In-Hand Manipulation with Multifingered Hands Via Visuomotor Diffusion,"We present a framework for learning dexterous in-hand manipulation with multifingered hands using visuomotor diffusion policies. Our system enables complex in-hand manipulation tasks, such as unscrewing a bottle lid with one hand, by leveraging a fast and responsive teleoperation setup for the four-fingered Allegro Hand. We collect high-quality expert demonstrations using an augmented reality (AR) interface that tracks hand movements and applies inverse kinematics and motion retargeting for precise control. The AR headset provides real-time visualization, while gesture controls streamline teleoperation. To enhance policy learning, we introduce a novel demonstration outlier removal approach based on HDBSCAN clustering and the Global-Local Outlier Score from Hierarchies (GLOSH) algorithm, effectively filtering out low-quality demonstrations that could degrade performance. We evaluate our approach extensively in real-world settings and provide all experimental videos on the project website: https://dex-manip.github.io/"
Wearable Roller Rings to Augment In-Hand Manipulation through Active Surfaces,"In-hand manipulation is a crucial ability for reorienting and repositioning objects within grasps. The main challenges in this are not only the complexity of the computational models, but also the risks of grasp instability caused by active finger motions, such as rolling, sliding, breaking, and remaking contacts. This paper presents the development of the Roller Ring (RR), a modular robotic attachment with active surfaces that is wearable by both robot and human hands to manipulate without lifting a finger. By installing the angled RRs on hands, such that their spatial motions are not colinear, we derive a general differential motion model for manipulating objects. Our motion model shows that complete in-hand manipulation skill sets can be provided by as few as only 2 RRs through non-holonomic object motions, while more RRs can enable enhanced manipulation dexterity with fewer motion constraints. Through extensive experiments, we test the RRs on both a robot hand and a human hand to evaluate their manipulation capabilities. We show that the RRs can be employed to manipulate arbitrary object shapes to provide dexterous in-hand manipulation."
Open-Loop Deep Reinforcement Learning Control of Soft Robotic In-Hand Manipulations,"In-hand manipulation tasks using hand-like robotic grippers offer a promising approach to accomplish various tasks in a human-centered environment. Due to the inherent safety of soft robots, in-hand manipulations performed by soft robots provide great opportunities for future human-robot collaboration, which is the scope of this paper. By modeling a new and innovative soft-robotic gripper known as the Anthropomorphic Soft Gripper and synthesis of an open-loop controller with deep reinforcement learning, it is demonstrated how the movement of objects by in-hand manipulations can be accomplished. Moreover, this work explores the application of deep reinforcement learning methods without the employment for domain randomization. As noted by Bhatt et al. the inherent soft properties of soft robotic grippers enable remarkably robust in-hand manipulation in open-loop control, giving the impetus for the approach that is being followed in this work. Motion sequences generated in simulation are successfully transferred to the real anthropomorphic soft gripper and validated in experiments."
Vibration-Induced Friction Modulation to Enable Controlled Sliding for In-Hand Manipulation,"Achieving controlled sliding of objects on finger surfaces is a significant challenge for robots, substantially constraining their ability to perform complex in-hand manipulation tasks. In this work, we investigate the role of surface vibration in modulating the effective friction at the object-finger contact locations to facilitate controlled sliding. We demonstrate that friction at contact points can be reduced by applying targeted vibrations at specific locations on a robotic finger, creating regions that are suitable for sliding. In this way, we create sticking/sliding regions on finger surfaces on demand and can easily switch between sliding and rolling contacts. To investigate this phenomenon, we embedded an array of vibration modules into robotic fingers. We first analyzed the velocity fields created by surface vibrations on a single finger. Then, we developed a method to select the appropriate activation states of the modules that achieve the desired velocity field at a given object location. Utilizing these fingers and the vibration selection method, we formed a two-finger robotic hand and demonstrated controlled sliding and rotation of a held object within the hand. To the best of our knowledge, this is the first work that utilizes vibration-induced friction modulation for in-hand manipulation that can achieve combinations of object sliding and rolling actions."
An Inflatable Deployable Origami Grasper for Adaptive and High-Load Grasping,"Robotic graspers are essential for enhancing the efficiency and versatility of robots in grasping tasks. In this paper, we propose a novel inflatable deployable origami grasper with a rigid-flexible coupling structure. The proposed grasper can achieve multiple deployment configurations under a single pneumatic actuation, enabling both deployment and grasping operations while also allowing for passive self-folding during deflation. The design and fabrication of the grasper are presented. Then, the stiffness model for the inflatable deployable origami unit is developed based on the equivalent truss method. Experimental results show that the grasper successfully grasps objects of various shapes and sizes in both enveloping and fingertip grasping modes, using either two or four fingers. With its simple mechanical system and high deploy/fold ratio, the proposed grasper holds significant potential for applications in industrial automation and space exploration."
Haptic-ACT: Bridging Human Intuition with Compliant Robotic Manipulation Via Immersive VR,"Robotic manipulation is essential for the widespread adoption of robots in industrial and home settings and has long been a focus within the robotics community. Advances in artificial intelligence have introduced promising learning-based methods to address this challenge, with imitation learning emerging as particularly effective. However, efficiently acquiring high-quality demonstrations remains a challenge. In this work, we introduce an immersive VR-based teleoperation setup designed to collect demonstrations from a remote human user. We also propose an imitation learning framework called Haptic Action Chunking with Transformers (Haptic-ACT). To evaluate the platform, we conducted a pick-and-place task and collected 50 demonstration episodes. Results indicate that the immersive VR platform significantly reduces demonstrator fingertip forces compared to systems without haptic feedback, enabling more delicate manipulation. Additionally, evaluations of the Haptic-ACT framework in both the MuJoCo simulator and on a real robot demonstrate its effectiveness in teaching robots more compliant manipulation compared to the original ACT. Additional materials are available at https://sites.google.com/view/hapticact."
High DOF Tendon-Driven Soft Hand: A Modular System for Versatile and Dexterous Manipulation,"The soft robotic hand exhibits a wide range of manipulation capabilities, which are attributed to the dexterity of its soft fingers and their coordinated movements. Therefore, designing a versatile soft hand requires careful consideration of both the characteristics of the individual fingers, such as degree of freedom (DOF), and their strategic arrangements to optimize performance for specific target tasks. This work presents a modularized high DOF tendon-driven soft finger and a customized design of a soft robotic hand for diverse dexterous manipulation tasks. Furthermore, an all-in-one module is developed that integrates both the 4-way tendon-driven soft finger body and drive parts. Its high DOF enables multi-directional actuations with a wide actuation range, thereby expanding possible manipulation modes. The modularity of the system expands the design space for finger arrangements, which enables the diverse configuration of robotic hands and facilitates the customization of task-oriented platforms. To achieve sophisticated control of these complex configurations, we employ neural network-planned trajectories, enabling the precise execution of complicated tasks. The performance of a single finger is validated, including dexterity and payload, and several real-world manipulation tasks are demonstrated, including writing, grasping, rotating, and spreading, using motion primitives of diverse soft hands with distinctive finger arrangements. These demonstrations showcase the system's versatility and precision in various tasks. We expect that our system will contribute to the expansion of possibilities in the field of soft robotic manipulation."
Peg-In-Hole Assembly Method Based on Visual Reinforcement Learning and Tactile Pose Estimation,"When robots replicate human actions in peg-in-hole assembly tasks, such as USB Type-A insertion and removal, the complexity of the process and frequent obstructions from the inner walls make it difficult for robots to handle collisions or avoid jamming. These difficulties contribute to a low success rate in assembly.This paper proposes a vision-guided reinforcement learning pre-assembly combined with tactile feedback-based pose estimation adjustment method for peg-in-hole assembly, achieving significant improvement in success rates for complex assembly tasks. First, during the pretraining process of reinforcement learning, high-reward sample data is collected, and a behaviour cloning (BC) algorithm is constructed based on sample data structure. The network is pretrained as a policy regression layer. Under sparse reward conditions, outputs of the twin delayed deep deterministic policy gradient (TD3) network and the BC network are combined to improve training stability and accelerate convergence, enhancing the efficiency of vision-based assembly. Then, to address the instability caused by collisions with the inner and outer walls of the hole when vision-based assembly remains incomplete, an in-hand pose estimation algorithm based on the Gelsight visuotactile sensor is integrated. This algorithm facilitates real-time adjustments to the position of the robotâ€™s end-effector, improving the likelihood of successful peg-in-hole assembly. Finally, to validate the effectiveness of the proposed method, experiments were conducted using the V-REP simulation platform and the real Franka robot platform. In the experiments, success rates of 90-93% and 80-85%, respectively, were achieved."
PneuChip: A Compact Pneumatic Controller for Large-Scale Soft Artificial Muscles,"Pneumatic soft actuators are known for their versatility and reliability; however, their control presents a major challenge as systems scale beyond tens of actuators. Traditional rigid pneumatic valves add bulk, weight, and complexity, while most soft valves fail to generate programmable independent output states. We propose PneuChip, a compact pneumatic controller designed for large-scale soft actuators. The PneuChip functions as a two-dimensional array with m rows and n columns, controlled by m+n input signals to generate 2^(m+n)-2^m-2^n+2 distinct output states, enabling programmable control over mÃ—n soft actuators. To validate its effectiveness, we implemented PneuChip in a muscular-skeletal robotic arm comprising 24 Miura-Ori inspired, negative pressure-actuated artificial muscles and a rigid two-link skeleton connected by a ball joint. A 4Ã—6 PneuChip was fabricated and integrated to control the armâ€™s 3 degree of freedoms (DOFs) motion. Within a 120Â° rotation range, the robot arm achieved 946 distinct positions with smooth state transitions, paving the way for future applications in trajectory tracking and dexterous manipulation. The compact design and high controllability of PneuChip promise to notably simplify complex pneumatic systems, significantly enhancing the practicality of large-scale soft robots for various applications."
A Bio-Inspired Stiffness-Programmable Robotic Flexible Joint Based on Electro-Adhesive Clutches,"Robots with active variable stiffness (VS) capabilities can potentially achieve safer interactions with humans and better adaptabilities to uncertainties in complex environments. Currently, the conventional jamming or phase-change-based VS mechanisms simultaneously act on the stiffnesses of the robotic joint in all axes, making it difficult to achieve decoupled stiffness programming in different directions/axes. To overcome this challenge, a bio-inspired stiffness-programmable robotic flexible joint (SPRFJ) based on the electro-adhesive (EA) clutches is proposed. By programming the ON/OFF states of the EA clutches on different surfaces around the SPRFJ, customization of stiffness profiles in different directions/axes can be realized, and therefore, the load-bearing capacity and flexibility of the robotic arm can be adjusted. A SPRFJ prototype consisting of four EA clutch units is developed, and through extensive experiments, we demonstrate that it can achieve a stiffness change of 21 times and can withstand resisting forces up to 13.41 N at 1 kV. The reliable multi-directional stiffness programmability of the SPRFJ is shown via extensive tests. Demonstrations on stable position locking at different angles and free movements while carrying payloads are conducted to showcase its application in soft robotics. This SPRFJ developed in this work processes the potential in industrial robots, search-and-rescue missions, and space explorations."
Modeling of Viscoelastic Liquid Crystal Elastomer Actuators,"Soft robots and smart materials have seen rapid advancements in recent years, with significant potential applications in medical devices. Liquid crystal elastomers (LCEs) are particularly known for their large deformations and diverse actuation modes, which can serve as the end effector in soft catheters. However, LCEs exhibit strong hysteresis, which make their modeling and control challenging. In this paper, we develop a dynamic model of a light-stimulated LCE to describe its nonlinear time-dependent behavior. We first derive the relationship between the input laser power and the resulting temperature change, and then analyze the viscoelastic behavior of the LCE by taking advantage of a spring-dashpot frame. For both the linear contraction actuator and the bending actuator, the dynamic equations can describe their behavior with acceptable errors. The model is well-suited for LCE actuators with complex structures and provides a foundation for future control."
A Crab-Inspired Soft Gripper with Single-Finger Dexterous Grasping Capabilities,"Soft grippers conform to the shape and surface properties of the objects to be grasped, effectively avoiding damage to soft and fragile items. Despite the variety of existing soft gripper designs, their structures lack sufficient flexibility for effectively grasping slender objects or operating in narrow spaces. To address these challenges, we propose a soft gripper with single-finger grasping capabilities, inspired by the structure of crab claws. The structural design and the fabrication method of the gripper are introduced, and the analytical bending model is derived. Experiments are conducted under typical operating conditions to validate the model, and the results indicate that the measured data are in good accordance with the predicted responses. Furthermore, a series of grasping experiments are carried out to test the single-finger grasping capabilities of the proposed soft gripper. The results indicate that the proposed soft gripper can efficiently and stably grasp slender or irregular objects with a single finger. In particular, it demonstrates suitability for operations in narrow spaces and shows potential for handling complex tasks. This innovative design effectively reduces the complexity of the system, while exhibiting promising capabilities in grasping slender or irregular objects and operating within restricted spaces."
A Novel Gripper with Semi-Peaucellier Linkage and Idle-Stroke Mechanism for Linear Pinching and Self-Adaptive Grasping,"This paper introduces a novel robotic gripper, named as the SPD gripper. It features a palm and two mechanically identical and symmetrically arranged fingers, which can be driven independently or by a single motor. The fingertips of the fingers follow a linear motion trajectory, facilitating the grasping of objects of various sizes on a tabletop without the need to adjust the overall height of the gripper. Traditional industrial grippers with parallel gripping capabilities often exhibit an arcuate motion at the fingertips, requiring the entire robotic arm to adjust its height to avoid collisions with the tabletop. The SPD gripper, with its linear parallel gripping mechanism, effectively addresses this issue. Furthermore, the SPD gripper possesses adaptive capabilities, accommodating objects of different shapes and sizes. This paper presents the design philosophy, fundamental composition principles, and optimization analysis theory of the SPD gripper. Based on the design theory, a robotic gripper prototype was developed and tested. The experimental results demonstrate that the robotic gripper successfully achieves linear parallel gripping functionality and exhibits good adaptability. In the context of the ongoing development of embodied intelligence technologies, this robotic gripper can assist various robots in achieving effective grasping, laying a solid foundation for collecting data to enhance deep learning training."
VTAO-BiManip: Masked Visual-Tactile-Action Pre-Training with Object Understanding for Bimanual Dexterous Manipulation,"Bimanual dexterous manipulation remains a significant challenge in robotics due to the high DoFs of each hand and their coordination. Existing single-hand manipulation techniques often leverage human demonstrations to guide RL methods but fail to generalize to complex bimanual tasks involving multiple sub-skills. In this paper, we propose VTAO-BiManip, a novel framework that integrates visual-tactile-action pre-training with object understanding, aiming to enable human-like bimanual manipulation via curriculum RL. We improve prior learning by incorporating hand motion data, providing more effective guidance for dual-hand coordination. Our pretraining model predicts future actions as well as object pose and size using masked multimodal inputs, facilitating cross-modal regularization. To address the multi-skill learning challenge, we introduce a two-stage curriculum RL approach to stabilize training. We evaluate our method on a bimanual bottle-cap twisting task, demonstrating its effectiveness in both simulated and real-world environments. Our approach achieves a success rate that surpasses existing visual-tactile pretraining methods by over 20%."
Adaptive Visuo-Tactile Fusion with Predictive Force Attention for Dexterous Manipulation,"Effectively utilizing multi-sensory data is important for robots to generalize across diverse tasks. However, the heterogeneous nature of these modalities makes fusion challenging. Existing methods propose strategies to obtain comprehensively fused features but often ignore the fact that each modality requires different levels of attention at different manipulation stages. To address this, we propose a force-guided attention fusion module that adaptively adjusts the weights of visual and tactile features without human labeling. We also introduce a self-supervised future force prediction auxiliary task to reinforce the tactile modality, improve data imbalance, and encourage proper adjustment. Our method achieves an average success rate of 93% across three fine-grained, contact-rich tasks in real-world experiments. Further analysis shows that our policy appropriately adjusts attention to each modality at different manipulation stages."
PNEUmorph: A Shape-Morphing Interface Comprising a Pneumatic Membrane Constrained by Variable-Length Tendons,"Soft shape-morphing technologies are explored in fields such as soft robotics, metamaterials and design, enabling systems to adapt dynamically through elastic deformations. Applied in mobile devices, actuators, interactive objects and environments, these systems can respond to functional needs and environmental stimuli, communicating information and enhancing human experiences. A primary design goal for these systems is achieving extensive and complex shape transformations. Traditionally, soft robotics employs a pneumatic active layer constrained by a passive layer, limiting the deformation range. However, using dual active layers can expand deformation potential. Expanding on these principles, this work introduces PNEUmorph: a pneumatic surface constrained by a network of variable-length tendons, allowing broader shape transformations than traditional single-layer systems. PNEUmorphâ€™s dual-layer actuation overcomes fixed deformation limits, significantly enhancing shape-morphing capabilities. This paper presents PNEUmorphâ€™s design and preliminary geometrical characterization, achieved through an interdisciplinary approach that merges design and soft robotics methods. This study details methods for simulation, fabrication, operation and evaluation, offering insights into experimental results and directions for advancing surface-based soft shape-morphing systems."
Eversion Robot for Endoscopic Vein Harvesting,"Soft eversion robots have demonstrated significant advantages in navigating within confined spaces with minimal friction, making them promising candidates for various intraluminal applications in medical, industrial, and exploratory domains. These types of growing robots enable frictionless movement within hollow structures. This paper introduces a novel growing robotic manipulator. The area of medical application is endoscopic vein harvesting. We present the design, implementation, and experimental validation of this eversion robot, investigating its growth behavior under varying pressure values and with different diameters, its ability to navigate along defined trajectories, and with a tool mounted to its tip. This eversion robot could enable vein dissection while preserving the surrounding fat layer, making it a promising innovation for minimally invasive vascular surgery and beyond."
Origami-Inspired Soft Gripper with Tunable Constant Force Output,"Soft robotic grippers gently and safely manipulate delicate objects due to their inherent adaptability and softness. Limited by insufficient stiffness and imprecise force control, conventional soft grippers are not suitable for applications that require stable grasping force. In this work, we propose a soft gripper that utilizes an origami-inspired structure to achieve tunable constant force output over a wide strain range. The geometry of each taper panel is established to provide necessary parameters such as protrusion distance, taper angle, and crease thickness required for 3D modeling and FEA analysis. Simulations and experiments show that by optimizing these parameters, our design can achieve a tunable constant force output. Moreover, the origami-inspired soft gripper dynamically adapts to different shapes while preventing excessive forces, with potential applications in logistics, manufacturing, and other industrial settings that require stable and adaptive operations."
"Grasp EveryThing (GET): 1-DoF, 3-Fingered Gripper with Tactile Sensing for Robust Grasping","We introduce the Grasp EveryThing (GET) gripper, a novel 1-DoF, 3-finger design for securely grasping objects of many shapes and sizes. Mounted on a standard parallel jaw actuator, the design features three narrow, tapered fingers arranged in a two-against-one configuration, where the two fingers converge into a V-shape. The GET gripper is more capable of conforming to object geometries and forming secure grasps than traditional designs with two flat fingers. Inspired by the principle of self-similarity, these V-shaped fingers enable secure grasping across a wide range of object sizes. Further to this end, fingers are parametrically designed for convenient resizing and interchangeability across robotic embodiments with a parallel jaw gripper. Additionally, we incorporate a rigid fingernail for ease in manipulating small objects. Tactile sensing can be integrated into the standalone finger via an externally-mounted camera. A neural network was trained to estimate normal force from tactile images with an average validation error of 1.3 N across a diverse set of geometries. In grasping 15 objects and performing 3 tasks via teleoperation, the GET fingers consistently outperformed standard flat fingers. All finger designs, compatible with multiple robotic embodiments, both incorporating and lacking tactile sensing, are available on"
