Paper Title,Abstract
AeroHaptix: A Wearable Vibrotactile Feedback System for Enhancing Collision Avoidance in UAV Teleoperation,"Haptic feedback enhances collision avoidance by providing directional obstacle information to operators during unmanned aerial vehicle (UAV) teleoperation. However, such feedback is often rendered via haptic joysticks, which are unfamiliar to UAV operators and limited to single-direction force feedback. Additionally, the direct coupling between the input device and the feedback method diminishes operators' sense of control and induces oscillatory movements. To overcome these limitations, we propose AeroHaptix, a wearable haptic feedback system that uses spatial vibrations to simultaneously communicate multiple obstacle directions to operators, without interfering with their input control. The layout of vibrotactile actuators was optimized via a perceptual study to eliminate perceptual biases and achieve uniform spatial coverage. A novel rendering algorithm, MultiCBF, extended control barrier functions to support multi-directional feedback. Our system evaluation showed that compared to a no-feedback condition, AeroHaptix effectively reduced the number of collisions and input disagreement. Furthermore, operators reported that AeroHaptix was more helpful than force feedback, with improved situational awareness and comparable workload."
A Lightweight Haptic Interface for Hand-To-Object Tasks with Spatiotemporal Displays (I),"Haptic interfaces create information transmission channels from machine to human with a natural way. Robust haptic interfaces with compact forms that provide high information throughput are of particular interest in industrial applications such as teleoperation, soft displays, virtual, and augmented reality. Here, we propose a haptic interface with spatiotemporal displays to convey high-dimensional information during successive hand-to-object tasks, which is architectural and psychophysical lightweight. The wearable and flexible architecture incorporates seven independently addressable vibration units at a pitch of 16 mm to allow spatiotemporal modulation. To prove the superiority of the haptic interface, four-day perceptual experiments are performed on 12 subjects with pattern discrimination tasks. We compared recognition accuracy (RA) between space-dependent and spatiotemporal strategies across the forearm, which are encoded based on finger states and morphological deformations. Furthermore, the mixed biomimetic strategy derived from both is intuitive and showed strength in terms of RA (over 88%) and information transfer (IT) (over 2.4 bit/s). With prior knowledge, are significantly better (RA over 90%) at the discrimination of sequential patterns. Moreover, the results demonstrate robust performance of the biomimetic strategy on location shift, which prove that subjects perceive relative information among vibratory units rather than absolute locations on the skin."
Human-Inspired Soft Anthropomorphic Hand System for Neuromorphic Object and Pose Recognition Using Multimodal Signals,"The human somatosensory system integrates multimodal sensory feedback, including tactile, proprioceptive, and thermal signals, to enable comprehensive perception and effective interaction with the environment. Inspired by the biological mechanism, we present a sensorized soft anthropomorphic hand equipped with diverse sensors designed to emulate the sensory modalities of the human hand. This system incorporates biologically inspired encoding schemes that convert multimodal sensory data into spike trains, enabling highly efficient processing through Spiking Neural Networks (SNNs). By utilizing these neuromorphic signals, the proposed framework achieves 97.14% accuracy in object recognition across varying poses, significantly outperforming previous studies on soft hands. Additionally, we introduce a novel differentiator neuron model to enhance material classification by capturing dynamic thermal responses. Our results demonstrate the benefits of multimodal sensory fusion and highlight the potential of neuromorphic approaches for achieving efficient, robust, and human-like perception in robotic systems."
Disambiguate Gripper State in Grasp-Based Tasks: Pseudo-Tactile As Feedback Enables Pure Simulation Learning,"Grasp-based manipulation tasks are fundamental to robots interacting with their environments, yet gripper state ambiguity significantly reduces the robustness of imitation learning policies for these tasks. Data-driven solutions face the challenge of high real-world data costs, while simulation data, despite its low costs, is limited by the sim-to-real gap. We identify the root cause of gripper state ambiguity as the lack of tactile feedback. To address this, we propose a novel approach employing pseudo-tactile as feedback, inspired by the idea of using a force-controlled gripper as a tactile sensor. This method enhances policy robustness without additional data collection and hardware involvement, while providing a noise-free binary gripper state observation for the policy and thus facilitating pure simulation learning to unleash the power of simulation. Experimental results across three real-world grasp-based tasks demonstrate the necessity, effectiveness, and efficiency of our approach."
SkB-Hand: A Skeleton Bionic Hand with Dual-Tendon for General Purpose Robotic Grasping Tasks,"The development of bionic hands is a crucial area robotics research, aiming to achieve human-like dexterity, adaptability, and efficiency in manipulation tasks. This study presents the Skeleton Bionic Hand (SkB-Hand), which features a dual elastic-tendon mechanism for extensor and volar plate in a single finger. The skeleton structure ensures the SkB-Hand is lightweight (< 600g) and low-cost (< 150USD) while maintaining performance in various grasping tasks. We evaluated the SkB-Hand through experiments such as the Kapandji test, GRASP Taxonomy, and dynamic scenarios. Results showed the SkB-Hand scored 7/10 in the Kapandji test and 33/33 in the GRASP Taxonomy test. The hand demonstrated resistance to deformation under external forces while ensuring flexibility. Integrated into the Techman Robot (TM-Robot), the SkB-Hand provide its potential for general robotic grasping tasks in daily life."
3D Vision-Tactile Reconstruction from Infrared and Visible Images for Robotic Fine-Grained Tactile Perception,"To achieve human-like haptic perception in anthropomorphic grippers, the compliant sensing surfaces of vision tactile sensor (VTS) must evolve from conventional planar configurations to biomimetically curved topographies with continuous surface gradients. However, planar VTSs have challenges when extended to curved surfaces, including insufficient lighting of surfaces, blurring in reconstruction, and complex spatial boundary conditions for surface structures. With an end goal of constructing a human-like fingertip, our research (i) develops GelSplitter3D by expanding imaging channels with a prism and a near-infrared (NIR) camera, (ii) proposes a photometric stereo neural network with a CAD-based normal ground truth generation method to calibrate tactile geometry, and (iii) devises a normal integration method with boundary constraints of depth prior information to correcting the cumulative error of surface integrals. We demonstrate better tactile sensing performance, a 40% improvement in normal estimation accuracy, and the benefits of sensor shapes in grasping and manipulation tasks."
A Multi-Layered Quantitative Assessment Approach for Hand Spasticity Based on a Cable-Actuated Hand Exoskeleton,"Over the past two decades, numerous hand exoskeletons have been developed for rehabilitation scenarios, yet very few have the capability to assess spasticity. This paper introduces a quantitative assessment approach for hand spasticity developed on a cable-driven hand exoskeleton that was specifically designed with spastic hand in mind. The exoskeleton features an adaptive cable-linkage transmission mechanism equipped with bi-directional force transducers, enabling constant-velocity extension and flexion of individual finger joints while simultaneously recording joint torque and angle. Based on the exoskeleton, a multi-layered quantitative assessment approach is proposed to evaluate spasticity on individual finger joints. The basis of the approach is collecting joint resistance information automatically following Modified Tardieu Scale, serving for the computation of six middle-level parameters related to the properties of a spastic joint. The parameters include the range of motion, average resistance torque, joint stiffness, joint viscosity, catch angle, and reflex-induced resistance torque. The first four mechanical parameters are finally combined into a biomechanical metric, whereas the rest two reflex-related parameters result in a neurological metric, to neatly describe spasticity level. The performance of the exoskeleton to measure the parameters was tested on six healthy subjects. The assessment approach applied with the developed exoskeleton shows good reliability, repeatability, and validity to capture the features of spastic hands, providing strong evidence for further validation on real patients."
An Improved Flexible Hand Exoskeleton with SEA for Finger Strength Estimation and Progressive Resistance Exercise,"Hand exoskeletons can recognize user's intent and provide active resistance training to enhance finger strength in stroke patients. However, achieving fine human-robot interaction (HRI) while maintaining system simplicity for lightweight design remains a key challenge. In this work, we present an improved flexible hand exoskeleton with series elastic actuator (SEA) for hand strength estimation and progressive resistance exercise. The SEA design allows the hand exoskeleton to have backdrivability to improve HRI performance. By combining the flexible linkage with the flex sensor, we propose a novel user interface that is able to sensitively acquire hand motion intent. An Extended Kalman Filter (EKF) based tracking errors estimation is designed to evaluate the finger strength. The results of the finger strength estimation are used to adjust the parameters of the admittance model to provide small or large damping when the user's finger strength is low or high, achieving active admittance control based progressive resistance exercise. The feasibility has been demonstrated by two sets of experiments, and this work has established a hand exoskeleton solution for finger strength estimation and fine human-robot interaction."
A Variable Stiffness Supernumerary Robotic Limb with Pneumatic-Tendon Coupled Actuation,"Supernumerary robotic limbs (SRLs) can assist humans in achieving efficient and comfortable work in daily life or industrial assembly scenarios, requiring SRLs to switch between rigidity and flexibility to perform compliant movements while also providing stable support for humans to reduce fatigue from prolonged standing, existing SRLs struggle to achieve this transition. In this study, a variable stiffness supernumerary robotic limb (VSSRL) is implemented, capable of adjusting its position and stiffness through pneumatic-tendon coupled actuation. The position of the VSSRL is accurately modulated by tendons, while its stiffness is controlled by pneumatic-tendon coupled actuation, tendons significantly increase the overall stiffness of the VSSRL, and the fiber-reinforced actuators (FRAs) can dynamically adjust its stiffness in response to changes in dynamic loads. Furthermore, a kinematic model of the VSSRL and a stiffness model under the coupling of FRAs and tendons are developed. Then, the trajectory and stiffness of the VSSRL in task execution are assigned based on human motion, and a multi-objective control system for both position and stiffness of the VSSRL is designed based on reinforcement learning (RL) algorithm, achieving collaborative control of position and stiffness for the VSSRL. The accuracy of the control system is validated through experiments, which demonstrate that the load capacity of the VSSRL is significantly enhanced under the action of tendons and FRAs, and that the VSSRL is able to provide various modes of assistance for daily life activities."
Touch-Sensitive Hand Interactions for Social Robots Using Fiber Bragg Grating Sensors,"Physical human-robot interaction (pHRI) has been demonstrated to be essential in the implementation of social assistive robots (SARs), which require advanced sensing capabilities for accurate and responsive engagement. This study presents the development and validation of a fiber Bragg grating (FBG) sensor network integrated into the hand of the CASTOR robot to classify complex pHRIs. Nine pHRIs were collected and evaluated within the high five, pets, handshakes, hits, and pinches categories. Four machine learning (ML) algorithms were tested, and the Bagged Decision Tree Classifier (BDTC) achieved the best performance. During testing, the model achieved an accuracy of 98%. The results demonstrate that the proposed FBG sensor network can classify complex pHRIs. Future work will explore additional instrumented areas of the robot and expand the physical interaction analysis to enhance social robot adaptability and user experience."
Haptic Shared Control of a Pair of Microrobots for Telemanipulation Using Constrained Optimization,"Microrobotics implies actuation-related constraints that make safe telemanipulation particularly challenging. We present a haptic shared control system for electromagnetic-based telemanipulation of a pair of microrobots using a constrained optimization framework. Our contributions include: (1) a Quadratic Programming formulation with Control Lyapunov Functions and Control Barrier Functions, for safe and stable navigation in cluttered environments; (2) a shared control architecture, combining a haptic interface and simulation environment, to teleoperate the microrobots and enable micromanipulation capabilities; and (3) haptic shared control strategies offering visuo-haptic cues for task execution. The approach is validated through a user study, highlighting better navigation accuracy, control stability and task efficiency."
TacCap: A Wearable FBG-Based Tactile Sensor for Seamless Human-To-Robot Skill Transfer,"Tactile sensing is essential for dexterous manipulation, yet large-scale human demonstration datasets lack tactile feedback, limiting their effectiveness in skill transfer to robots. To address this, we introduce TacCap, a wearable Fiber Bragg Grating (FBG)-based tactile sensor designed for seamless human-to-robot transfer. TacCap is lightweight, durable, and immune to electromagnetic interference, making it ideal for real-world data collection. We detail its design and fabrication, evaluate its sensitivity, repeatability, and cross-sensor consistency, and assess its effectiveness through grasp stability prediction and ablation studies. Our results demonstrate that TacCap enables transferable tactile data collection, bridging the gap between human demonstrations and robotic execution. To support further research and development, we open-source our hardware design and software."
UniTac-NV: A Unified Tactile Representation for Non-Vision-Based Tactile Sensors,"Generalizable algorithms for tactile sensing remain underexplored, primarily due to the diversity of sensor modalities. Recently, many methods for cross-sensor transfer between optical (vision-based) tactile sensors have been investigated, yet little work focus on non-optical tactile sensors. To address this gap, we propose an encoder-decoder architecture to unify tactile data across non-vision-based sensors. By leveraging sensor-specific encoders, the framework creates a latent space that is sensor-agnostic, enabling cross-sensor data transfer with low errors and direct use in downstream applications. We leverage this network to unify tactile data from two commercial tactile sensors: the Xela uSkin uSPa 46 and the Contactile PapillArray. Both were mounted on a UR5e robotic arm, performing force-controlled pressing sequences against distinct object shapes (circular, square, and hexagonal prisms) and two materials (rigid PLA and flexible TPU). Another more complex unseen object was also included to investigate the model's generalization capabilities. We show that alignment in latent space can be implicitly learned from joint autoencoder training with matching contacts collected via different sensors. We further demonstrate the practical utility of our approach through contact geometry estimation, where downstream models trained on one sensor's latent representation can be directly applied to another without retraining."
"High Resolution, Large Area Vision-Based Tactile Sensing Based on a Novel Piezoluminescent Skin","The ability to precisely perceive external physical interactions would enable robots to interact effectively with the environment and humans. While vision-based tactile sensing has improved robotic grippers, it is challenging to realize high resolution vision-based tactile sensing in robot arms due to presence of curved surfaces, difficulty in uniform illumination, and large distance of sensing area from the cameras. In this paper, we propose a novel piezoluminescent skin that transduces external applied pressures into changes in light intensity on the other side for viewing by a camera for pressure estimation. By engineering elastomer layers with specific optical properties and integrating a flexible electroluminescent panel as a light source, we develop a compact tactile sensing layer that resolves the layout issues in curved surfaces. We achieved multipoint pressure estimation over an expansive area of 502 sq. cm with high spatial resolution, a Two-Point Discrimination distance of 3 mm horizontally and 5 mm vertically which is comparable to that of human fingers as well as a high localization accuracy (RMSE of 1.92 mm). These promising attributes make this tactile sensing technique suitable for use in robot arms and other applications requiring high resolution tactile information over a large area."
Compact LED-Based Displacement Sensing for Robot Fingers,"In this paper, we introduce a sensor designed for integration in robot fingers, where it can provide information on the displacements induced by external contact. Our sensor uses LEDs to sense the displacement between two plates connected by a transparent elastomer; when a force is applied to the finger, the elastomer displaces and the LED signals change. We show that using LEDs as both light emitters an receivers in this context provides high sensitivity, allowing such an emitter and receiver pairs to detect very small displacements. We characterize the standalone performance of the sensor by testing the ability of a supervised learning model to predict complete force and torque data from its raw signals, and obtain a mean error between 0.05 and 0.07 N across the three directions of force applied to the finger. Our method allows for finger-size packaging with no amplification electronics, low cost manufacturing, easy integration into a complete hand, and high overload shear forces and bending torques, suggesting future applicability to complete manipulation tasks."
A Variable-Stiffness Neck Exoskeleton with Pneumatic-Driven Actuators for Prolonged Head Flexion Assistance,"Surgeons are frequently subjected to prolonged unnatural postures, such as sustained neck flexion during surgical procedures, increasing their susceptibility to work-related musculoskeletal disorders (WMSDs). Despite the prevalence of such issues, there remains a scarcity of ergonomic solutions that effectively mitigate neck pain while permitting full operational functionality across diverse environments. In this paper, we present a novel variable-stiffness neck exoskeleton with pneumatic-driven tensile actuators for prolonged head flexion assistance. Its innovative design facilitates unrestricted head movement while providing expected neck support, thereby minimizing strain on antagonist muscle groups. Comprehensive experimental evaluations were conducted to assess the systemâ€™s performance. Transitional response times between flexible and rigid states were 0.28 s and 0.46 s, respectively. Experimental trials involving five healthy subjects demonstrated that the average muscular activity reduction of the splenius capitis and the sternocleidomastoid muscles were 38.8Â±2.0% and 9.7Â±2.5%, respectively. These experimental results demonstrated great potential of the exoskeleton in practical application for alleviating the physical burden during prolonged head flexion."
Design and Control of Soft Robotic Wearable with SMA-Based Artificial Muscle Fibers for Ankle Assistance,"Soft robotic wearables, with lightweight and flexible actuation, have shown promising results in assistive applications. However, it remains unclear whether they can be made fully comfortable and suitable for everyday use. In this study, we introduce a clothing-type soft robotic wearable embedded with shape memory alloy (SMA) based artificial muscle fibers for ankle plantarflexion assistance. We conducted force characterization of SMA wires, analyzing the effects of thickness, strain, applied current, and number of wires. The actuator was designed to achieve assistive force of 80 N and implemented a closed-loop controller with a PI controller to enable precise force and displacement control. Last, we demonstrate that the developed system can deliver controlled and repeatable forces in bench tests and modulate peak force according to target assistive levels on the ankle during walking in a user study."
Exo-ViHa: A Cross-Platform Exoskeleton System with Visual and Haptic Feedback for Efficient Dexterous Skill Learning,"Imitation learning has emerged as a powerful paradigm for robot skills learning. However, traditional data collection systems for dexterous manipulation face challenges, including a lack of balance between acquisition efficiency, consistency, and accuracy. To address these issues, we introduce Exo-ViHa, an innovative 3D-printed exoskeleton system that enables users to collect data from a first-person perspective while providing real-time haptic feedback. This system combines a 3D-printed modular structure with a slam camera, a motion capture glove, and a wrist-mounted camera. Various dexterous hands can be installed at the end, enabling it to simultaneously collect the posture of the end effector, hand movements, and visual data. By leveraging the first-person perspective and direct interaction, the exoskeleton enhances the task realism and haptic feedback, improving the consistency between demonstrations and actual robot deployments. In addition, it has cross-platform compatibility with various robotic arms and dexterous hands. Experiments show that the system can significantly improve the success rate and efficiency of data collection for dexterous manipulation tasks."
A Two-Stage Dynamic Parameters Identification Approach Based on Kalman Filter for Haptic Rendering in Telerobotics,"In teleoperated physical Human-Robot Interaction (pHRI), accurate contact force feedback is essential for operators to experience intuitive and responsive interaction. However, the presence of end-effectors on the manipulator often interferes with the force feedback, misrepresenting the real contact forces. To render a precise force to operators, it is critical to eliminate the non-contact forces arising from the end-effector toolâ€™s inertia. To achieve this, the fast and accurate dynamic parameters identification for the end-effectors is essential. Currently, existing dynamic identification algorithms process all collected data in one stage, in which the sensor noises for static and dynamic parameters are coupled, resulting in poor performance. In this letter, we propose a two-stage method for end-effector's inertial parameters identification. Our proposed method breaks the identification process into two steps: the static and the dynamic processing stages, which can make full use of data features and significantly improve the accuracy of mass and Center-of-Mass (COM) identification. Additionally, we introduce the Kalman Filter (KF) into the linear fitting to improve the identification speed. Comparative and ablation experiments are designed to validate the effectiveness of the proposed method. The results demonstrate that our method outperforms the RTLS method in reducing identification errors by 96% for mass and 81.2%â€“87.6% for COM. As for the haptic rendering, the errors are also reduced by 36.3% in direction of interaction and 99.5% in direction of gravity after the elimination of the end-effectorâ€™s inertia."
ViaTac: A High-Resolution Piezoresistive Tactile Sensor Array with Conformal Contact Surface for Shape Reconstruction,"Tactile sensing is crucial for robots to achieve human-like manipulation capabilities and safe interaction with the environment. Existing piezoresistive tactile sensors often suffer from limited spatial resolution and poor conformability to contact objects due to their unstretchable contact surfaces. In this paper, we present a low-cost and easily fabricated piezoresistive tactile sensor array that utilizes flexible printed circuit (FPC) via as electrodes to achieve high spatial resolution (64/cm^2), while incorporating stretchable materials for surface encapsulation to enable conformal contact with objects. Unified material selection for both the sensing and encapsulation layers ensures robust performance. We characterized the sensing performance, mechanical durability, and uniformity of the sensor array and further demonstrated its practical applications in contact shape reconstruction."
